{
  "contributors": [
    {
      "credit_statement": "Synthetic Person A: Conceptualization (lead), Writing – original draft (lead).",
      "disclosure": {
        "approval_ids": [
          "ap-a"
        ],
        "approved_fields": [
          "credit_assertions",
          "display_name",
          "orcid"
        ],
        "public": true,
        "reason": null
      },
      "display_name": "Synthetic Person A",
      "id": "person-a",
      "kind": "person",
      "legacy_author_id": null,
      "orcid": {
        "id": "0000-0002-1825-0097",
        "status": "verified",
        "verification": {
          "method": "orcid-oauth",
          "ref": "orcid-auth:synthetic-a",
          "verified_at": "2026-09-05T00:00:00Z"
        }
      }
    },
    {
      "credit_statement": "Synthetic Person B: Writing – review & editing (equal).",
      "disclosure": {
        "approval_ids": [
          "ap-b"
        ],
        "approved_fields": [
          "credit_assertions",
          "display_name"
        ],
        "public": true,
        "reason": null
      },
      "display_name": "Synthetic Person B",
      "id": "person-b",
      "kind": "person",
      "legacy_author_id": null,
      "orcid": {
        "id": "0000-0000-0000-001X",
        "status": "claimed"
      }
    },
    {
      "credit_statement": "Synthetic Unpublished Collaborator C: Investigation.",
      "disclosure": {
        "approval_ids": [],
        "approved_fields": [],
        "public": false,
        "reason": "missing-required-grant"
      },
      "display_name": "Synthetic Unpublished Collaborator C",
      "id": "person-c",
      "kind": "person",
      "legacy_author_id": null,
      "orcid": {
        "id": "0000-0000-0000-0028",
        "status": "claimed"
      }
    },
    {
      "credit_statement": "Synthetic Person D: Conceptualization (equal), Writing – review & editing.",
      "disclosure": {
        "approval_ids": [
          "ap-d"
        ],
        "approved_fields": [
          "credit_assertions",
          "display_name"
        ],
        "public": true,
        "reason": null
      },
      "display_name": "Synthetic Person D",
      "id": "person-d",
      "kind": "person",
      "legacy_author_id": "person-d",
      "orcid": {
        "id": "0000-0000-0000-0036",
        "status": "claimed"
      }
    },
    {
      "credit_statement": "Synthetic Person E: Validation.",
      "disclosure": {
        "approval_ids": [],
        "approved_fields": [],
        "public": false,
        "reason": "approval-for-other-version"
      },
      "display_name": "Synthetic Person E",
      "id": "person-e",
      "kind": "person",
      "legacy_author_id": null,
      "orcid": null
    }
  ],
  "credit_assertions": [
    {
      "asserted_at": "2026-09-06T00:00:00Z",
      "assertion_id": "a-001",
      "contributor": "person-a",
      "degree": "lead",
      "role": "conceptualization",
      "role_label": "Conceptualization",
      "role_uri": "https://credit.niso.org/contributor-roles/conceptualization/",
      "source_kind": "controller",
      "source_ref": "decision:credit-001",
      "status": "confirmed",
      "status_ref": "decision:credit-001",
      "target": {
        "kind": "review"
      }
    },
    {
      "asserted_at": "2026-09-06T00:00:00Z",
      "assertion_id": "a-002",
      "contributor": "person-a",
      "degree": "lead",
      "role": "writing-original-draft",
      "role_label": "Writing – original draft",
      "role_uri": "https://credit.niso.org/contributor-roles/writing-original-draft/",
      "source_kind": "self-declared",
      "source_ref": "form:synthetic-a",
      "status": "declared",
      "status_ref": null,
      "target": {
        "kind": "review"
      }
    },
    {
      "asserted_at": "2026-09-06T00:00:00Z",
      "assertion_id": "a-003",
      "contributor": "person-a",
      "degree": "supporting",
      "role": "methodology",
      "role_label": "Methodology",
      "role_uri": "https://credit.niso.org/contributor-roles/methodology/",
      "source_kind": "self-declared",
      "source_ref": "form:synthetic-a",
      "status": "declared",
      "status_ref": null,
      "target": {
        "claim_id": "clm_c7ed170000000001",
        "kind": "claim"
      }
    },
    {
      "asserted_at": "2026-09-06T00:00:00Z",
      "assertion_id": "a-004",
      "contributor": "person-b",
      "degree": "equal",
      "role": "writing-review-editing",
      "role_label": "Writing – review & editing",
      "role_uri": "https://credit.niso.org/contributor-roles/writing-review-editing/",
      "source_kind": "corresponding-author",
      "source_ref": "form:synthetic-corresponding",
      "status": "declared",
      "status_ref": null,
      "target": {
        "kind": "review"
      }
    },
    {
      "asserted_at": "2026-09-06T00:00:00Z",
      "assertion_id": "a-005",
      "contributor": "person-b",
      "degree": null,
      "role": "software",
      "role_label": "Software",
      "role_uri": "https://credit.niso.org/contributor-roles/software/",
      "source_kind": "self-declared",
      "source_ref": "form:synthetic-b",
      "status": "disputed",
      "status_ref": "dispute:synthetic-005",
      "target": {
        "kind": "review"
      }
    },
    {
      "asserted_at": "2026-09-06T00:00:00Z",
      "assertion_id": "a-006",
      "contributor": "person-b",
      "degree": null,
      "role": "supervision",
      "role_label": "Supervision",
      "role_uri": "https://credit.niso.org/contributor-roles/supervision/",
      "source_kind": "self-declared",
      "source_ref": "form:synthetic-b",
      "status": "withdrawn",
      "status_ref": "withdrawal:synthetic-006",
      "target": {
        "kind": "review"
      }
    },
    {
      "asserted_at": "2026-09-06T00:00:00Z",
      "assertion_id": "a-007",
      "contributor": "person-c",
      "degree": null,
      "role": "investigation",
      "role_label": "Investigation",
      "role_uri": "https://credit.niso.org/contributor-roles/investigation/",
      "source_kind": "self-declared",
      "source_ref": "form:synthetic-c",
      "status": "declared",
      "status_ref": null,
      "target": {
        "kind": "review"
      }
    },
    {
      "asserted_at": "2026-09-06T00:00:00Z",
      "assertion_id": "a-008",
      "contributor": "person-d",
      "degree": "equal",
      "role": "conceptualization",
      "role_label": "Conceptualization",
      "role_uri": "https://credit.niso.org/contributor-roles/conceptualization/",
      "source_kind": "controller",
      "source_ref": "decision:credit-008",
      "status": "confirmed",
      "status_ref": "decision:credit-008",
      "target": {
        "kind": "review"
      }
    },
    {
      "asserted_at": "2026-09-06T00:00:00Z",
      "assertion_id": "a-009",
      "contributor": "person-e",
      "degree": null,
      "role": "validation",
      "role_label": "Validation",
      "role_uri": "https://credit.niso.org/contributor-roles/validation/",
      "source_kind": "self-declared",
      "source_ref": "form:synthetic-e",
      "status": "declared",
      "status_ref": null,
      "target": {
        "kind": "review"
      }
    },
    {
      "asserted_at": null,
      "assertion_id": "legacy:person-d:writing-review-editing",
      "contributor": "person-d",
      "degree": null,
      "role": "writing-review-editing",
      "role_label": "Writing – review & editing",
      "role_uri": "https://credit.niso.org/contributor-roles/writing-review-editing/",
      "source_kind": "legacy-author-file",
      "source_ref": "content/authors.yml#person-d",
      "status": "declared",
      "status_ref": null,
      "target": {
        "kind": "review"
      }
    }
  ],
  "credit_standard": "ANSI/NISO Z39.104-2022",
  "legacy_role_labels": [
    {
      "contributor": "person-d",
      "credit_eligible": true,
      "field": "roles",
      "label": "Conceptualization",
      "level": null,
      "mapped_role": "conceptualization",
      "mapping": "exact",
      "position": 0,
      "source_ref": "content/authors.yml#person-d"
    },
    {
      "contributor": "person-d",
      "credit_eligible": true,
      "field": "roles",
      "label": "Writing - Review & Editing",
      "level": null,
      "mapped_role": "writing-review-editing",
      "mapping": "normalized",
      "position": 1,
      "source_ref": "content/authors.yml#person-d"
    },
    {
      "contributor": "person-d",
      "credit_eligible": false,
      "field": "roles",
      "label": "Statistics",
      "level": null,
      "mapped_role": null,
      "mapping": "unmappable",
      "position": 2,
      "source_ref": "content/authors.yml#person-d"
    },
    {
      "contributor": "person-d",
      "credit_eligible": true,
      "field": "credit_levels",
      "label": "Conceptualization",
      "level": "lead",
      "mapped_role": "conceptualization",
      "mapping": "exact",
      "position": 3,
      "source_ref": "content/authors.yml#person-d"
    }
  ],
  "production": {
    "agent_runs": [
      {
        "agent_id": "ai-pipeline",
        "credit_channel": "production",
        "kind": "software-agent",
        "legacy_author_id": "ai-pipeline",
        "legacy_role_labels": [
          {
            "credit_eligible": false,
            "field": "roles",
            "label": "Investigation",
            "level": null,
            "mapped_role": "investigation",
            "mapping": "exact",
            "position": 0
          },
          {
            "credit_eligible": false,
            "field": "roles",
            "label": "Data Curation",
            "level": null,
            "mapped_role": "data-curation",
            "mapping": "normalized",
            "position": 1
          },
          {
            "credit_eligible": false,
            "field": "roles",
            "label": "Writing – original draft",
            "level": null,